"","title","employ22","employ32","med_wage","entry_educ","onjob_training"
"691","Riggers",19.7,20,54680,"High school diploma or equivalent","Moderate-term on-the-job training"
"692","Rock splitters, quarry",4.1,4.1,46010,"No formal educational credential","Short-term on-the-job training"
"693","Rolling machine setters, operators, and tenders, metal and plastic",28.2,25.1,46310,"High school diploma or equivalent","Moderate-term on-the-job training"
"694","Roof bolters, mining",1.8,1.3,60210,"High school diploma or equivalent","Moderate-term on-the-job training"
"695","Roofers",154.5,157.6,47920,"No formal educational credential","Moderate-term on-the-job training"
"696","Rotary drill operators, oil and gas",13.2,13.2,55260,"No formal educational credential","Moderate-term on-the-job training"
"697","Roustabouts, oil and gas",42.1,43.3,43590,"No formal educational credential","Moderate-term on-the-job training"
"698","Sailors and marine oilers",30.7,31.3,47490,"No formal educational credential","Moderate-term on-the-job training"
"699","Sales and related workers, all other",136.8,142.9,44120,"High school diploma or equivalent","None"
"700","Sales engineers",60.9,63.8,108530,"Bachelor's degree","Moderate-term on-the-job training"
"701","Sales managers",554.7,577.2,130600,"Bachelor's degree","None"
"702","Sales representatives of services, except advertising, insurance, financial services, and travel",1113.2,1158.9,62400,"High school diploma or equivalent","Moderate-term on-the-job training"
"703","Sales representatives, wholesale and manufacturing, except technical and scientific products",1344.3,1353.4,63230,"High school diploma or equivalent","Moderate-term on-the-job training"
"704","Sales representatives, wholesale and manufacturing, technical and scientific products",305.6,317.1,97710,"Bachelor's degree","Moderate-term on-the-job training"
"705","Sawing machine setters, operators, and tenders, wood",49.4,49.5,36270,"High school diploma or equivalent","Moderate-term on-the-job training"
"706","School bus monitors",62.4,60.1,29880,"High school diploma or equivalent","Short-term on-the-job training"
"707","School psychologists",62.2,63,81500,"Master's degree","Internship/residency"
"708","Secondary school teachers, except special and career/technical education",1072.3,1083.4,62360,"Bachelor's degree","None"
"709","Secretaries and administrative assistants, except legal, medical, and executive",2030.2,1794.3,41000,"High school diploma or equivalent","Short-term on-the-job training"
"710","Securities, commodities, and financial services sales agents",482.2,517.7,67480,"Bachelor's degree","Moderate-term on-the-job training"
"711","Security and fire alarm systems installers",83,85.3,50130,"High school diploma or equivalent","Moderate-term on-the-job training"
"712","Security guards",1155.9,1141,34750,"High school diploma or equivalent","Short-term on-the-job training"
"713","Self-enrichment teachers",354.7,366.1,44110,"High school diploma or equivalent","None"
"714","Semiconductor processing technicians",24.6,26.6,44690,"High school diploma or equivalent","Moderate-term on-the-job training"
"715","Separating, filtering, clarifying, precipitating, and still machine setters, operators, and tenders",55.6,57.6,46250,"High school diploma or equivalent","Moderate-term on-the-job training"
"716","Septic tank servicers and sewer pipe cleaners",29.5,31.7,45610,"High school diploma or equivalent","Moderate-term on-the-job training"
"717","Service unit operators, oil and gas",39.5,39.5,50140,"No formal educational credential","Moderate-term on-the-job training"
"718","Set and exhibit designers",27.8,29.8,59990,"Bachelor's degree","None"
"719","Sewers, hand",6.9,5.8,31530,"No formal educational credential","Moderate-term on-the-job training"
"720","Sewing machine operators",141.9,120.3,31740,"No formal educational credential","Short-term on-the-job training"
"721","Shampooers",11.3,12.6,27860,"No formal educational credential","Short-term on-the-job training"
"722","Sheet metal workers",126.2,126,55350,"High school diploma or equivalent","Apprenticeship"
"723","Ship engineers",9.3,9.4,87300,"Postsecondary nondegree award","None"
"724","Shipping, receiving, and inventory clerks",862.9,790.6,37760,"High school diploma or equivalent","Short-term on-the-job training"
"725","Shoe and leather workers and repairers",9.8,8.7,32460,"High school diploma or equivalent","Moderate-term on-the-job training"
"726","Shoe machine operators and tenders",3.3,2.9,33060,"High school diploma or equivalent","Short-term on-the-job training"
"727","Shuttle drivers and chauffeurs",218.4,235.9,32800,"No formal educational credential","Short-term on-the-job training"
"728","Signal and track switch repairers",6.6,6.7,81300,"High school diploma or equivalent","Moderate-term on-the-job training"
"729","Skincare specialists",82,89.4,38060,"Postsecondary nondegree award","None"
"730","Slaughterers and meat packers",81.1,80.3,35240,"No formal educational credential","Short-term on-the-job training"
"731","Social and community service managers",178.4,194.6,74240,"Bachelor's degree","None"
"732","Social and human service assistants",415.1,450.6,38520,"High school diploma or equivalent","Short-term on-the-job training"
"733","Social science research assistants",34.4,36,50470,"Bachelor's degree","None"
"734","Social sciences teachers, postsecondary, all other",19.2,19.7,75390,"Doctoral or professional degree","None"
"735","Social scientists and related workers, all other",36.5,37.2,88900,"Bachelor's degree","None"
"736","Social work teachers, postsecondary",15.5,16.1,66510,"Doctoral or professional degree","None"
"737","Social workers, all other",68.4,72.9,61420,"Bachelor's degree","None"
"738","Sociologists",3.3,3.4,98590,"Master's degree","None"
"739","Sociology teachers, postsecondary",15,15.5,78970,"Doctoral or professional degree","None"
"740","Software developers",1594.5,2004.9,127260,"Bachelor's degree","None"
"741","Software quality assurance analysts and testers",200.8,241.6,99620,"Bachelor's degree","None"
"742","Soil and plant scientists",17.2,18.1,65730,"Bachelor's degree","None"
"743","Solar photovoltaic installers",29.4,35.9,45230,"High school diploma or equivalent","Moderate-term on-the-job training"
"744","Sound engineering technicians",17.6,17.4,60670,"Postsecondary nondegree award","Short-term on-the-job training"
"745","Special education teachers, all other",43.9,45.2,63950,"Bachelor's degree","None"
"746","Special education teachers, kindergarten and elementary school",194.7,194.6,62390,"Bachelor's degree","None"
"747","Special education teachers, middle school",82.8,82.6,62990,"Bachelor's degree","None"
"748","Special education teachers, preschool",23.8,24.3,62240,"Bachelor's degree","None"
"749","Special education teachers, secondary school",153.2,154,63560,"Bachelor's degree","None"
"750","Special effects artists and animators",89.3,96.6,98950,"Bachelor's degree","None"
"751","Speech-language pathologists",171.4,204.5,84140,"Master's degree","Internship/residency"
"752","Stationary engineers and boiler operators",33.5,34.4,67120,"High school diploma or equivalent","Long-term on-the-job training"
"753","Statistical assistants",7.4,7.2,48880,"Bachelor's degree","None"
"754","Statisticians",33.3,43.9,98920,"Master's degree","None"
"755","Stockers and order fillers",2851.6,3030.3,34220,"High school diploma or equivalent","Short-term on-the-job training"
"756","Stonemasons",13.5,12.7,50210,"High school diploma or equivalent","Apprenticeship"
"757","Structural iron and steel workers",71.6,72.9,60500,"High school diploma or equivalent","Apprenticeship"
"758","Structural metal fabricators and fitters",59.6,49.8,47200,"High school diploma or equivalent","Moderate-term on-the-job training"
"759","Substance abuse, behavioral disorder, and mental health counselors",388.2,459.6,49710,"Bachelor's degree","None"
"760","Substitute teachers, short-term",421.6,438.9,35250,"Bachelor's degree","None"
"761","Subway and streetcar operators",9.5,9.8,88260,"High school diploma or equivalent","Moderate-term on-the-job training"
"762","Surgeons, all other",26.5,26.8,239200,"Doctoral or professional degree","Internship/residency"
"763","Surgical assistants",19.7,20.7,57290,"Postsecondary nondegree award","None"
"764","Surgical technologists",109.2,115.2,55960,"Postsecondary nondegree award","None"
"765","Survey researchers",8.8,8.4,60410,"Master's degree","None"
"766","Surveying and mapping technicians",64.2,66.3,47180,"High school diploma or equivalent","Moderate-term on-the-job training"
"767","Surveyors",50.8,53.1,63080,"Bachelor's degree","Internship/residency"
"768","Switchboard operators, including answering service",48.4,36.2,34670,"High school diploma or equivalent","Short-term on-the-job training"
"769","Tailors, dressmakers, and custom sewers",33.9,29.3,34280,"No formal educational credential","Moderate-term on-the-job training"
"770","Tank car, truck, and ship loaders",13.3,13.5,53930,"No formal educational credential","Short-term on-the-job training"
"771","Tapers",18.1,17.7,62360,"No formal educational credential","Moderate-term on-the-job training"
"772","Tax examiners and collectors, and revenue agents",55,55.4,57950,"Bachelor's degree","Moderate-term on-the-job training"
"773","Tax preparers",109.5,111.1,48250,"High school diploma or equivalent","Moderate-term on-the-job training"
"774","Taxi drivers",177.3,213.7,30670,"No formal educational credential","Short-term on-the-job training"
"775","Teachers and instructors, all other",148,150.9,61250,"Bachelor's degree","None"
"776","Teaching assistants, except postsecondary",1298.9,1299.8,30920,"Some college, no degree","None"
"777","Teaching assistants, postsecondary",170.2,177.3,38050,"Bachelor's degree","None"
"778","Technical writers",53.3,57,79960,"Bachelor's degree","Short-term on-the-job training"
"779","Telecommunications equipment installers and repairers, except line installers",173.7,184.7,59960,"Postsecondary nondegree award","Moderate-term on-the-job training"
"780","Telecommunications line installers and repairers",112.1,119.6,60580,"High school diploma or equivalent","Long-term on-the-job training"
"781","Telemarketers",97.7,77.6,31030,"No formal educational credential","Short-term on-the-job training"
"782","Telephone operators",4.1,3,38330,"High school diploma or equivalent","Short-term on-the-job training"
"783","Tellers",364.1,311.1,36380,"High school diploma or equivalent","Short-term on-the-job training"
"784","Terrazzo workers and finishers",1.6,1.4,52330,"High school diploma or equivalent","Apprenticeship"
"785","Textile bleaching and dyeing machine operators and tenders",7,6.4,32680,"High school diploma or equivalent","Short-term on-the-job training"
"786","Textile cutting machine setters, operators, and tenders",11.1,9.9,34420,"High school diploma or equivalent","Moderate-term on-the-job training"
"787","Textile knitting and weaving machine setters, operators, and tenders",17.8,15.9,35750,"High school diploma or equivalent","Short-term on-the-job training"
"788","Textile winding, twisting, and drawing out machine setters, operators, and tenders",25,22.9,33720,"High school diploma or equivalent","Moderate-term on-the-job training"
"789","Textile, apparel, and furnishings workers, all other",14.3,13.2,32640,"High school diploma or equivalent","Short-term on-the-job training"
"790","Therapists, all other",42.3,47.5,60800,"Bachelor's degree","None"
"791","Tile and stone setters",59.4,63.5,48340,"No formal educational credential","Long-term on-the-job training"
"792","Timing device assemblers and adjusters",0.4,0.3,42290,"High school diploma or equivalent","Moderate-term on-the-job training"
"793","Tire builders",18.9,18.1,51650,"High school diploma or equivalent","Moderate-term on-the-job training"
"794","Tire repairers and changers",103.8,105,34240,"High school diploma or equivalent","Short-term on-the-job training"
"795","Title examiners, abstractors, and searchers",62.2,63.3,50490,"High school diploma or equivalent","Moderate-term on-the-job training"
"796","Tool and die makers",62.7,57.4,59800,"Postsecondary nondegree award","Long-term on-the-job training"
"797","Tool grinders, filers, and sharpeners",5.5,5,41940,"High school diploma or equivalent","Moderate-term on-the-job training"
"798","Tour and travel guides",53.6,58,34440,"High school diploma or equivalent","Moderate-term on-the-job training"
"799","Traffic technicians",7.6,7.9,50050,"High school diploma or equivalent","Moderate-term on-the-job training"
"800","Training and development managers",41.3,44,120000,"Bachelor's degree","None"
"801","Training and development specialists",385.8,409.9,63080,"Bachelor's degree","None"
"802","Transit and railroad police",3.4,3.5,69150,"High school diploma or equivalent","Moderate-term on-the-job training"
"803","Transportation inspectors",25.7,26.4,79570,"High school diploma or equivalent","Moderate-term on-the-job training"
"804","Transportation security screeners",51.3,51.3,47710,"High school diploma or equivalent","Short-term on-the-job training"
"805","Transportation workers, all other",12.1,12.6,37430,"High school diploma or equivalent","Short-term on-the-job training"
"806","Transportation, storage, and distribution managers",177.7,192.3,98560,"High school diploma or equivalent","None"
"807","Travel agents",66.3,68.6,46400,"High school diploma or equivalent","Moderate-term on-the-job training"
"808","Tree trimmers and pruners",66,67.6,47080,"High school diploma or equivalent","Short-term on-the-job training"
"809","Tutors",223.7,231.1,36680,"Some college, no degree","None"
"810","Umpires, referees, and other sports officials",20.4,22.4,36010,"High school diploma or equivalent","Moderate-term on-the-job training"
"811","Underground mining machine operators, all other",2.3,2,64180,"No formal educational credential","Moderate-term on-the-job training"
"812","Upholsterers",31.5,30.7,39600,"High school diploma or equivalent","Moderate-term on-the-job training"
"813","Urban and regional planners",44.7,46.4,79540,"Master's degree","None"
"814","Ushers, lobby attendants, and ticket takers",106.6,108.3,27650,"No formal educational credential","Short-term on-the-job training"
"815","Veterinarians",89.5,107.2,103260,"Doctoral or professional degree","None"
"816","Veterinary assistants and laboratory animal caretakers",114.8,138.3,34740,"High school diploma or equivalent","Short-term on-the-job training"
"817","Veterinary technologists and technicians",122.9,148.1,38240,"Associate's degree","None"
"818","Waiters and waitresses",2194.1,2125.5,29120,"No formal educational credential","Short-term on-the-job training"
"819","Watch and clock repairers",2.1,1.4,48370,"High school diploma or equivalent","Long-term on-the-job training"
"820","Water and wastewater treatment plant and system operators",124.8,116.9,51600,"High school diploma or equivalent","Long-term on-the-job training"
"821","Web and digital interface designers",117.9,135.8,83240,"Bachelor's degree","None"
"822","Web developers",98.8,115.5,78580,"Bachelor's degree","None"
"823","Weighers, measurers, checkers, and samplers, recordkeeping",55.6,54,39950,"High school diploma or equivalent","Short-term on-the-job training"
"824","Welders, cutters, solderers, and brazers",431.8,438,47540,"High school diploma or equivalent","Moderate-term on-the-job training"
"825","Welding, soldering, and brazing machine setters, operators, and tenders",32.9,30.1,44920,"High school diploma or equivalent","Moderate-term on-the-job training"
"826","Wellhead pumpers",16.2,15.9,63280,"High school diploma or equivalent","Moderate-term on-the-job training"
"827","Wind turbine service technicians",11.2,16.2,57320,"Postsecondary nondegree award","Long-term on-the-job training"
"828","Woodworkers, all other",13.5,13,35370,"High school diploma or equivalent","Moderate-term on-the-job training"
"829","Woodworking machine setters, operators, and tenders, except sawing",64.6,63.9,36830,"High school diploma or equivalent","Moderate-term on-the-job training"
"830","Word processors and typists",44,27,44330,"High school diploma or equivalent","Short-term on-the-job training"
"831","Writers and authors",151.2,156.8,73150,"Bachelor's degree","Long-term on-the-job training"
"832","Zoologists and wildlife biologists",19.1,19.7,67430,"Bachelor's degree","None"
