"","title","employ22","employ32","med_wage","entry_educ","onjob_training"
"459","Loan interviewers and clerks",247.1,244.6,46490,"High school diploma or equivalent","Short-term on-the-job training"
"460","Loan officers",354.8,365.3,65740,"Bachelor's degree","Moderate-term on-the-job training"
"461","Locker room, coatroom, and dressing room attendants",12.9,13.8,30210,"High school diploma or equivalent","Short-term on-the-job training"
"462","Locksmiths and safe repairers",18.2,16.1,47400,"High school diploma or equivalent","Long-term on-the-job training"
"463","Locomotive engineers",29.7,29.9,74570,"High school diploma or equivalent","Moderate-term on-the-job training"
"464","Lodging managers",50.8,54.2,61910,"High school diploma or equivalent","None"
"465","Log graders and scalers",5.6,5.5,42370,"High school diploma or equivalent","Moderate-term on-the-job training"
"466","Logging equipment operators",35.3,34,46400,"High school diploma or equivalent","Moderate-term on-the-job training"
"467","Logging workers, all other",4.9,4.6,47110,"High school diploma or equivalent","Moderate-term on-the-job training"
"468","Logisticians",208.7,246.9,77520,"Bachelor's degree","None"
"469","Machine feeders and offbearers",51.5,54.3,38040,"No formal educational credential","Short-term on-the-job training"
"470","Machinists",327,333.3,48510,"High school diploma or equivalent","Long-term on-the-job training"
"471","Magnetic resonance imaging technologists",41.4,44.6,80090,"Associate's degree","None"
"472","Maids and housekeeping cleaners",1238.8,1240.4,29960,"No formal educational credential","Short-term on-the-job training"
"473","Mail clerks and mail machine operators, except postal service",72.8,69.4,35070,"High school diploma or equivalent","Short-term on-the-job training"
"474","Maintenance and repair workers, general",1607.2,1664.4,44980,"High school diploma or equivalent","Moderate-term on-the-job training"
"475","Maintenance workers, machinery",63.6,67.1,53310,"High school diploma or equivalent","Long-term on-the-job training"
"476","Makeup artists, theatrical and performance",4.6,4.9,96370,"Postsecondary nondegree award","None"
"477","Management analysts",987.6,1083.3,95290,"Bachelor's degree","None"
"478","Managers, all other",1228.3,1269.4,128620,"Bachelor's degree","None"
"479","Manicurists and pedicurists",196.9,214,31130,"Postsecondary nondegree award","None"
"480","Manufactured building and mobile home installers",4.1,3.2,36820,"High school diploma or equivalent","Short-term on-the-job training"
"481","Marine engineers and naval architects",8,8.1,96910,"Bachelor's degree","None"
"482","Market research analysts and marketing specialists",868.6,985.2,68230,"Bachelor's degree","None"
"483","Marketing managers",358.2,381.9,140040,"Bachelor's degree","None"
"484","Marriage and family therapists",71.2,81.8,56570,"Master's degree","Internship/residency"
"485","Massage therapists",134.3,158.9,49860,"Postsecondary nondegree award","None"
"486","Material moving workers, all other",26.1,27,38800,"No formal educational credential","Short-term on-the-job training"
"487","Materials engineers",22.3,23.5,100140,"Bachelor's degree","None"
"488","Materials scientists",7.9,8.3,104380,"Bachelor's degree","None"
"489","Mathematical science occupations, all other",4.1,4.4,71700,"Bachelor's degree","None"
"490","Mathematical science teachers, postsecondary",55.9,57.7,77420,"Doctoral or professional degree","None"
"491","Mathematicians",2.3,2.3,112110,"Master's degree","None"
"492","Meat, poultry, and fish cutters and trimmers",141,143.8,35070,"No formal educational credential","Short-term on-the-job training"
"493","Mechanical door repairers",28,30.6,47010,"High school diploma or equivalent","Moderate-term on-the-job training"
"494","Mechanical drafters",49.6,46,61310,"Associate's degree","None"
"495","Mechanical engineering technologists and technicians",41.1,41.4,61990,"Associate's degree","None"
"496","Mechanical engineers",286.1,314.7,96310,"Bachelor's degree","None"
"497","Media and communication equipment workers, all other",17.3,17.9,69490,"High school diploma or equivalent","Short-term on-the-job training"
"498","Media and communication workers, all other",25.8,26.9,65000,"High school diploma or equivalent","Short-term on-the-job training"
"499","Medical and health services managers",509.5,654.2,104830,"Bachelor's degree","None"
"500","Medical appliance technicians",16.6,17.1,42160,"High school diploma or equivalent","Moderate-term on-the-job training"
"501","Medical assistants",764.4,870.2,38270,"Postsecondary nondegree award","None"
"502","Medical dosimetrists",3.5,3.6,128970,"Bachelor's degree","None"
"503","Medical equipment preparers",66.7,70.3,41480,"High school diploma or equivalent","Moderate-term on-the-job training"
"504","Medical equipment repairers",66.4,75.1,57860,"Associate's degree","Moderate-term on-the-job training"
"505","Medical records specialists",194.3,210.9,47180,"Postsecondary nondegree award","None"
"506","Medical scientists, except epidemiologists",119,130.7,99930,"Doctoral or professional degree","None"
"507","Medical secretaries and administrative assistants",696.6,743.2,38500,"High school diploma or equivalent","Moderate-term on-the-job training"
"508","Medical transcriptionists",49,47.2,34730,"Postsecondary nondegree award","None"
"509","Meeting, convention, and event planners",132,141.9,52560,"Bachelor's degree","None"
"510","Mental health and substance abuse social workers",113.5,125.5,51240,"Master's degree","Internship/residency"
"511","Merchandise displayers and window trimmers",173.4,177.5,35380,"High school diploma or equivalent","Short-term on-the-job training"
"512","Metal workers and plastic workers, all other",21.4,19.8,38340,"High school diploma or equivalent","Moderate-term on-the-job training"
"513","Metal-refining furnace operators and tenders",19.7,18.1,50280,"High school diploma or equivalent","Moderate-term on-the-job training"
"514","Meter readers, utilities",21.1,18.5,44760,"High school diploma or equivalent","Short-term on-the-job training"
"515","Microbiologists",20.9,22,81990,"Bachelor's degree","None"
"516","Middle school teachers, except special and career/technical education",625.5,630.6,61810,"Bachelor's degree","None"
"517","Milling and planing machine setters, operators, and tenders, metal and plastic",15.7,13.5,46870,"High school diploma or equivalent","Moderate-term on-the-job training"
"518","Millwrights",42.1,43.4,60930,"High school diploma or equivalent","Apprenticeship"
"519","Mining and geological engineers, including mining safety engineers",7.5,7.6,97490,"Bachelor's degree","None"
"520","Miscellaneous assemblers and fabricators",1500.4,1388.6,37280,"High school diploma or equivalent","Moderate-term on-the-job training"
"521","Miscellaneous construction and related workers",32.3,33,44890,"High school diploma or equivalent","Moderate-term on-the-job training"
"522","Mixing and blending machine setters, operators, and tenders",114,115.8,43410,"High school diploma or equivalent","Moderate-term on-the-job training"
"523","Mobile heavy equipment mechanics, except engines",169.1,177.6,59440,"High school diploma or equivalent","Long-term on-the-job training"
"524","Model makers, metal and plastic",3.4,2.8,57620,"High school diploma or equivalent","Moderate-term on-the-job training"
"525","Model makers, wood",1.1,1,46940,"High school diploma or equivalent","Moderate-term on-the-job training"
"526","Models",2.2,2.2,43130,"No formal educational credential","None"
"527","Molders, shapers, and casters, except metal and plastic",44.7,45.8,39590,"High school diploma or equivalent","Long-term on-the-job training"
"528","Molding, coremaking, and casting machine setters, operators, and tenders, metal and plastic",167.9,161.7,37050,"High school diploma or equivalent","Moderate-term on-the-job training"
"529","Morticians, undertakers, and funeral arrangers",24.5,25.4,51570,"Associate's degree","Long-term on-the-job training"
"530","Motion picture projectionists",2.1,1.9,33360,"No formal educational credential","Short-term on-the-job training"
"531","Motor vehicle operators, all other",68.3,73.7,33210,"No formal educational credential","Short-term on-the-job training"
"532","Motorboat mechanics and service technicians",29.3,31,48280,"High school diploma or equivalent","Long-term on-the-job training"
"533","Motorboat operators",3.6,3.7,41430,"Postsecondary nondegree award","None"
"534","Motorcycle mechanics",17.1,17.4,43370,"Postsecondary nondegree award","Short-term on-the-job training"
"535","Multiple machine tool setters, operators, and tenders, metal and plastic",139.9,140.7,39210,"High school diploma or equivalent","Moderate-term on-the-job training"
"536","Museum technicians and conservators",14.4,15.9,47270,"Bachelor's degree","None"
"537","Music directors and composers",51.8,52.4,62940,"Bachelor's degree","None"
"538","Musical instrument repairers and tuners",7,6.3,38150,"High school diploma or equivalent","Apprenticeship"
"539","Musicians and singers",173.5,175.6,NA,"No formal educational credential","Long-term on-the-job training"
"540","Natural sciences managers",86.3,90.5,144440,"Bachelor's degree","None"
"541","Network and computer systems administrators",339.9,348.2,90520,"Bachelor's degree","None"
"542","Neurologists",12.2,12.5,224260,"Doctoral or professional degree","Internship/residency"
"543","New accounts clerks",46.6,39.8,40820,"High school diploma or equivalent","Moderate-term on-the-job training"
"544","News analysts, reporters, and journalists",58.5,56.6,55960,"Bachelor's degree","None"
"545","Nuclear engineers",13.8,13.9,122480,"Bachelor's degree","None"
"546","Nuclear medicine technologists",18.1,18.2,85300,"Associate's degree","None"
"547","Nuclear power reactor operators",5.5,5.3,115870,"High school diploma or equivalent","Long-term on-the-job training"
"548","Nuclear technicians",5.9,5.8,100420,"Associate's degree","Moderate-term on-the-job training"
"549","Nurse anesthetists",49.4,53.8,203090,"Master's degree","None"
"550","Nurse midwives",8.2,8.7,120880,"Master's degree","None"
"551","Nurse practitioners",266.3,384.9,121610,"Master's degree","None"
"552","Nursing assistants",1361.3,1417.8,35760,"Postsecondary nondegree award","None"
"553","Nursing instructors and teachers, postsecondary",85.9,101.5,78580,"Doctoral or professional degree","None"
"554","Obstetricians and gynecologists",22.9,23.4,239200,"Doctoral or professional degree","Internship/residency"
"555","Occupational health and safety specialists",113.8,128.9,78570,"Bachelor's degree","None"
"556","Occupational health and safety technicians",24.7,27.2,57970,"High school diploma or equivalent","Moderate-term on-the-job training"
"557","Occupational therapists",139.6,155.6,93180,"Master's degree","None"
"558","Occupational therapy aides",3.8,4,37060,"High school diploma or equivalent","Short-term on-the-job training"
"559","Occupational therapy assistants",45.1,56,64250,"Associate's degree","None"
"560","Office and administrative support workers, all other",215.1,197.3,38660,"High school diploma or equivalent","Short-term on-the-job training"
"561","Office clerks, general",2668.2,2492.8,38040,"High school diploma or equivalent","Short-term on-the-job training"
"562","Office machine operators, except computer",31.6,27.1,36710,"High school diploma or equivalent","Short-term on-the-job training"
"563","Operating engineers and other construction equipment operators",437.6,449.2,51430,"High school diploma or equivalent","Moderate-term on-the-job training"
"564","Operations research analysts",109.9,134.7,85720,"Bachelor's degree","None"
"565","Ophthalmic laboratory technicians",21.3,21.6,36810,"High school diploma or equivalent","Moderate-term on-the-job training"
"566","Ophthalmic medical technicians",66.5,74.9,38860,"Postsecondary nondegree award","None"
"567","Ophthalmologists, except pediatric",12.8,13.3,219810,"Doctoral or professional degree","Internship/residency"
"568","Opticians, dispensing",73.3,75.2,39610,"High school diploma or equivalent","Long-term on-the-job training"
"569","Optometrists",43.4,47.3,125590,"Doctoral or professional degree","None"
"570","Oral and maxillofacial surgeons",4.9,5.1,239200,"Doctoral or professional degree","Internship/residency"
"571","Order clerks",132.8,108.6,38060,"Some college, no degree","Short-term on-the-job training"
"572","Orderlies",45.5,47.4,34520,"High school diploma or equivalent","Short-term on-the-job training"
"573","Orthodontists",7.2,7.5,174360,"Doctoral or professional degree","Internship/residency"
"574","Orthopedic surgeons, except pediatric",19.4,19.7,239200,"Doctoral or professional degree","Internship/residency"
"575","Orthotists and prosthetists",9.5,10.9,77070,"Master's degree","Internship/residency"
"576","Outdoor power equipment and other small engine mechanics",41.6,42.1,40030,"High school diploma or equivalent","Moderate-term on-the-job training"
"577","Packaging and filling machine operators and tenders",373.2,390.5,36750,"High school diploma or equivalent","Moderate-term on-the-job training"
"578","Packers and packagers, hand",659.6,652.9,32920,"No formal educational credential","Short-term on-the-job training"
"579","Painters, construction and maintenance",372.4,377.9,46090,"No formal educational credential","Moderate-term on-the-job training"
"580","Painting, coating, and decorating workers",13.5,13.5,38270,"No formal educational credential","Moderate-term on-the-job training"
"581","Paper goods machine setters, operators, and tenders",92.7,82.5,45710,"High school diploma or equivalent","Moderate-term on-the-job training"
"582","Paperhangers",3.9,4,44930,"No formal educational credential","Long-term on-the-job training"
"583","Paralegals and legal assistants",354.3,369.1,59200,"Associate's degree","None"
"584","Paramedics",98.3,103.6,49090,"Postsecondary nondegree award","None"
"585","Parking attendants",108.4,110,30570,"No formal educational credential","Short-term on-the-job training"
"586","Parking enforcement workers",9,8.9,41570,"High school diploma or equivalent","Short-term on-the-job training"
"587","Parts salespersons",266.1,268.7,35800,"No formal educational credential","Moderate-term on-the-job training"
"588","Passenger attendants",13.5,14,34630,"High school diploma or equivalent","Short-term on-the-job training"
"589","Patternmakers, metal and plastic",2.3,1.8,54970,"High school diploma or equivalent","Moderate-term on-the-job training"
"590","Patternmakers, wood",0.5,0.5,44290,"High school diploma or equivalent","Moderate-term on-the-job training"
"591","Paving, surfacing, and tamping equipment operators",42.3,43.9,47270,"High school diploma or equivalent","Moderate-term on-the-job training"
"592","Payroll and timekeeping clerks",165.4,138.3,49630,"High school diploma or equivalent","Moderate-term on-the-job training"
"593","Pediatric surgeons",0.8,0.8,239200,"Doctoral or professional degree","Internship/residency"
"594","Pediatricians, general",35.9,36.2,190350,"Doctoral or professional degree","Internship/residency"
"595","Personal care and service workers, all other",87,104.9,34670,"High school diploma or equivalent","Short-term on-the-job training"
"596","Personal financial advisors",327.6,369.6,95390,"Bachelor's degree","Long-term on-the-job training"
"597","Personal service managers, all other",23.1,24.1,56090,"High school diploma or equivalent","None"
"598","Pest control workers",95,98,38310,"High school diploma or equivalent","Moderate-term on-the-job training"
"599","Pesticide handlers, sprayers, and applicators, vegetation",23.2,23.7,41440,"High school diploma or equivalent","Moderate-term on-the-job training"
"600","Petroleum engineers",21.4,21.9,131800,"Bachelor's degree","None"
"601","Petroleum pump system operators, refinery operators, and gaugers",32.2,31.5,85090,"High school diploma or equivalent","Moderate-term on-the-job training"
"602","Pharmacists",334.2,342.9,132750,"Doctoral or professional degree","None"
"603","Pharmacy aides",43.7,42.4,33270,"High school diploma or equivalent","Short-term on-the-job training"
"604","Pharmacy technicians",459.6,485.5,37790,"High school diploma or equivalent","Moderate-term on-the-job training"
"605","Philosophy and religion teachers, postsecondary",29.1,29.9,78780,"Doctoral or professional degree","None"
"606","Phlebotomists",139.4,150.2,38530,"Postsecondary nondegree award","None"
"607","Photographers",148.9,155,40170,"High school diploma or equivalent","Moderate-term on-the-job training"
"608","Photographic process workers and processing machine operators",6.4,5.6,36280,"High school diploma or equivalent","Short-term on-the-job training"
"609","Physical scientists, all other",25.4,25.9,107970,"Bachelor's degree","None"
"610","Physical therapist aides",44.5,45.8,31410,"High school diploma or equivalent","Short-term on-the-job training"
"611","Physical therapist assistants",100.7,126.9,62770,"Associate's degree","None"
"612","Physical therapists",246.8,284.1,97720,"Doctoral or professional degree","None"
"613","Physician assistants",148,187.3,126010,"Master's degree","None"
"614","Physicians, all other",330.9,341,223410,"Doctoral or professional degree","Internship/residency"
"615","Physicians, pathologists",13.2,13.9,239200,"Doctoral or professional degree","Internship/residency"
"616","Physicists",21.1,22.1,142850,"Doctoral or professional degree","None"
"617","Physics teachers, postsecondary",16.2,16.8,86550,"Doctoral or professional degree","None"
"618","Pile driver operators",3.3,3.4,64310,"High school diploma or equivalent","Moderate-term on-the-job training"
"619","Pipelayers",38,36.3,45990,"No formal educational credential","Short-term on-the-job training"
"620","Plant and system operators, all other",15.9,15.9,57470,"High school diploma or equivalent","Moderate-term on-the-job training"
"621","Plasterers and stucco masons",27.3,27.9,49730,"No formal educational credential","Long-term on-the-job training"
"622","Plating machine setters, operators, and tenders, metal and plastic",32.9,29.8,37900,"High school diploma or equivalent","Moderate-term on-the-job training"
"623","Plumbers, pipefitters, and steamfitters",482.7,493.6,60090,"High school diploma or equivalent","Apprenticeship"
"624","Podiatrists",10.6,10.7,148720,"Doctoral or professional degree","Internship/residency"
"625","Police and sheriff's patrol officers",684,706.5,65790,"High school diploma or equivalent","Moderate-term on-the-job training"
"626","Political science teachers, postsecondary",19.3,20,83770,"Doctoral or professional degree","None"
"627","Political scientists",6.2,6.6,128020,"Master's degree","None"
"628","Postal service clerks",74.8,69.8,56200,"No formal educational credential","Short-term on-the-job training"
"629","Postal service mail carriers",314.5,293.5,54250,"No formal educational credential","Short-term on-the-job training"
"630","Postal service mail sorters, processors, and processing machine operators",115,102.1,49130,"No formal educational credential","Short-term on-the-job training"
"631","Postmasters and mail superintendents",13,12.1,82760,"High school diploma or equivalent","Moderate-term on-the-job training"
"632","Postsecondary teachers, all other",262.8,272.3,76920,"Doctoral or professional degree","None"
"633","Pourers and casters, metal",6.2,5.6,45070,"High school diploma or equivalent","Moderate-term on-the-job training"
"634","Power distributors and dispatchers",9.6,9.1,101650,"High school diploma or equivalent","Long-term on-the-job training"
"635","Power plant operators",32.2,28.2,93060,"High school diploma or equivalent","Long-term on-the-job training"
"636","Precision instrument and equipment repairers, all other",12.1,12.1,61690,"High school diploma or equivalent","Long-term on-the-job training"
"637","Prepress technicians and workers",25.7,21.3,43560,"Postsecondary nondegree award","None"
"638","Preschool teachers, except special education",512.3,529.6,35330,"Associate's degree","None"
"639","Pressers, textile, garment, and related materials",29.8,23.3,29690,"No formal educational credential","Short-term on-the-job training"
"640","Print binding and finishing workers",41.4,34.6,36970,"High school diploma or equivalent","Moderate-term on-the-job training"
"641","Printing press operators",155.5,142.3,39350,"High school diploma or equivalent","Moderate-term on-the-job training"
"642","Private detectives and investigators",38.3,40.6,52120,"High school diploma or equivalent","Moderate-term on-the-job training"
"643","Probation officers and correctional treatment specialists",93.9,96.2,59860,"Bachelor's degree","Moderate-term on-the-job training"
"644","Procurement clerks",65.3,60.4,45240,"High school diploma or equivalent","Moderate-term on-the-job training"
"645","Producers and directors",175.3,187,85320,"Bachelor's degree","None"
"646","Production workers, all other",275.3,279.2,35490,"High school diploma or equivalent","Moderate-term on-the-job training"
"647","Production, planning, and expediting clerks",396.8,413.3,50630,"High school diploma or equivalent","Moderate-term on-the-job training"
"648","Project management specialists",881.3,936,95370,"Bachelor's degree","None"
"649","Proofreaders and copy markers",7.2,6.9,45410,"Bachelor's degree","None"
"650","Property appraisers and assessors",77.6,81.1,61560,"Bachelor's degree","Long-term on-the-job training"
"651","Property, real estate, and community association managers",429.6,453,60670,"High school diploma or equivalent","Short-term on-the-job training"
"652","Prosthodontists",0.4,0.5,NA,"Doctoral or professional degree","Internship/residency"
"653","Protective service workers, all other",95,97.9,36460,"High school diploma or equivalent","Short-term on-the-job training"
"654","Psychiatric aides",32.4,34,37160,"High school diploma or equivalent","Short-term on-the-job training"
"655","Psychiatric technicians",107.1,117.5,37380,"Postsecondary nondegree award","Short-term on-the-job training"
"656","Psychiatrists",28.6,30.5,226880,"Doctoral or professional degree","Internship/residency"
"657","Psychologists, all other",56.3,59.1,106420,"Master's degree","Internship/residency"
"658","Psychology teachers, postsecondary",50.9,53.6,78810,"Doctoral or professional degree","None"
"659","Public relations managers",72,76.3,129430,"Bachelor's degree","None"
"660","Public relations specialists",297.1,315.1,67440,"Bachelor's degree","None"
"661","Public safety telecommunicators",99.5,102.9,46900,"High school diploma or equivalent","Moderate-term on-the-job training"
"662","Pump operators, except wellhead pumpers",11.2,11.6,55860,"High school diploma or equivalent","Moderate-term on-the-job training"
"663","Purchasing managers",77.5,80.9,131350,"Bachelor's degree","None"
"664","Radiation therapists",15.9,16.3,89530,"Associate's degree","None"
"665","Radio, cellular, and tower equipment installers and repairers",13.5,13.9,59720,"Associate's degree","Moderate-term on-the-job training"
"666","Radiologic technologists and technicians",222.8,235,65140,"Associate's degree","None"
"667","Radiologists",31.2,32.4,239200,"Doctoral or professional degree","Internship/residency"
"668","Rail car repairers",20.1,20.8,62510,"High school diploma or equivalent","Long-term on-the-job training"
"669","Rail transportation workers, all other",2.4,2.4,42280,"High school diploma or equivalent","Moderate-term on-the-job training"
"670","Rail yard engineers, dinkey operators, and hostlers",2.6,2.6,56340,"High school diploma or equivalent","Moderate-term on-the-job training"
"671","Rail-track laying and maintenance equipment operators",16.5,16.7,63230,"High school diploma or equivalent","Moderate-term on-the-job training"
"672","Railroad brake, signal, and switch operators and locomotive firers",12.2,12.3,67540,"High school diploma or equivalent","Moderate-term on-the-job training"
"673","Railroad conductors and yardmasters",34.2,34.6,68180,"High school diploma or equivalent","Moderate-term on-the-job training"
"674","Real estate brokers",127.2,131.6,62190,"High school diploma or equivalent","None"
"675","Real estate sales agents",462.6,477.6,49980,"High school diploma or equivalent","Moderate-term on-the-job training"
"676","Receptionists and information clerks",1068.8,1072.7,33960,"High school diploma or equivalent","Short-term on-the-job training"
"677","Recreation and fitness studies teachers, postsecondary",16.3,16.8,72650,"Doctoral or professional degree","None"
"678","Recreation workers",289.4,302.7,31680,"High school diploma or equivalent","Short-term on-the-job training"
"679","Recreational therapists",16.8,17.4,51330,"Bachelor's degree","None"
"680","Recreational vehicle service technicians",17.7,19.4,45030,"High school diploma or equivalent","Long-term on-the-job training"
"681","Refractory materials repairers, except brickmasons",0.6,0.5,50550,"High school diploma or equivalent","Moderate-term on-the-job training"
"682","Refuse and recyclable material collectors",146.4,151.1,43540,"No formal educational credential","Short-term on-the-job training"
"683","Registered nurses",3172.5,3349.9,81220,"Bachelor's degree","None"
"684","Rehabilitation counselors",84.8,86.4,39990,"Master's degree","None"
"685","Reinforcing iron and rebar workers",22.8,23.1,51070,"High school diploma or equivalent","Apprenticeship"
"686","Religious workers, all other",75.8,76.2,39370,"Bachelor's degree","None"
"687","Reservation and transportation ticket agents and travel clerks",123,124.6,39160,"High school diploma or equivalent","Short-term on-the-job training"
"688","Residential advisors",95.7,101.4,35720,"High school diploma or equivalent","Short-term on-the-job training"
"689","Respiratory therapists",133.1,149.8,70540,"Associate's degree","None"
"690","Retail salespersons",3765.6,3686.4,30600,"No formal educational credential","Short-term on-the-job training"
